{
  "schemaVersion": 1,
  "generatedAt": "2026-07-12T07:32:42.938Z",
  "status": "probing",
  "target": {
    "runtime": "browserpod",
    "runtimeVersion": "2.12.1",
    "browserBaseline": "Desktop Chromium; Firefox and WebKit pending BrowserPod evidence."
  },
  "artifact": {
    "package": "openclaw",
    "version": "2026.7.1-beta.5",
    "integrity": "sha512-ejdttiBZwk5RJmZdGD3gQPW1+4819pb0gyw4ZbGg/NcEAdozk6UQWq4n3P2XfDBgOn2k7D8fSKLcN+YDdJ77TA==",
    "nodeEngine": ">=22.19.0 <23 || >=23.11.0",
    "tarballBytes": 19872338,
    "unpackedBytes": 87593195,
    "directDependencyCount": 56,
    "directDependencies": [
      {
        "name": "@agentclientprotocol/sdk",
        "spec": "1.1.0",
        "resolvedVersion": "1.1.0",
        "integrity": "sha512-NT2KqphUJ3w6EksUL51ZhJgIYgq/ZLGcBPkyMKgRSO5PMVwe9DnKKX+Htnvk6KHh6dUuh34UHK4gKp+4te1Mdg=="
      },
      {
        "name": "@anthropic-ai/sdk",
        "spec": "0.109.1",
        "resolvedVersion": "0.109.1",
        "integrity": "sha512-q9OnEKLr5H9nxSuXdgDgJhxfYMiE+AaUEBze2Gk91UcaaLnsN+Lx5fbCYywiqurU/APLdwv23x03Wm6WN3EBsg=="
      },
      {
        "name": "@clack/core",
        "spec": "1.4.2",
        "resolvedVersion": "1.4.2",
        "integrity": "sha512-0Ty/1Gfm+Kb07sXcuESjyKfwEhSy4Ns1AgeEisHb/bDY5fWme0tTeTkU14T1Gmcs17YIjB/teiDe4uaCghbYqQ=="
      },
      {
        "name": "@clack/prompts",
        "spec": "1.6.0",
        "resolvedVersion": "1.6.0",
        "integrity": "sha512-EYlRokl8szrP9Z25qT5aepMdBjzBvHF9ZEhzIiUBc9guz/T31EqRgvD0QSgZcpE93xiwrr+OkB4nz0BZyF6fSA=="
      },
      {
        "name": "@earendil-works/pi-tui",
        "spec": "0.80.3",
        "resolvedVersion": "0.80.3",
        "integrity": "sha512-2BJI6qwRQfnM0Q7seL1+SbacU/jRRjBnN7Hu3n9BjAn7/s5FaBNnvdD1qBQYRsFTHfjqMaDsjYqanPyqwXj99w=="
      },
      {
        "name": "@google/genai",
        "spec": "2.10.0",
        "resolvedVersion": "2.10.0",
        "integrity": "sha512-e4cFxj3tiuMtsgOT4G9c1hXyGJhg7/Buj7VVeBacRY3fRtkRZZ59Q3nuVp2xbq8BGQXLXCDB253qMhklMOeUDg=="
      },
      {
        "name": "@grammyjs/runner",
        "spec": "2.0.3",
        "resolvedVersion": "2.0.3",
        "integrity": "sha512-nckmTs1dPWfVQteK9cxqxzE+0m1VRvluLWB8UgFzsjg62w3qthPJt0TYtJBEdG7OedvfQq4vnFAyE6iaMkR42A=="
      },
      {
        "name": "@grammyjs/transformer-throttler",
        "spec": "1.2.1",
        "resolvedVersion": "1.2.1",
        "integrity": "sha512-CpWB0F3rJdUiKsq7826QhQsxbZi4wqfz1ccKX+fr+AOC+o8K7ZvS+wqX0suSu1QCsyUq2MDpNiKhyL2ZOJUS4w=="
      },
      {
        "name": "@homebridge/ciao",
        "spec": "1.3.9",
        "resolvedVersion": "1.3.9",
        "integrity": "sha512-TMy9zy173jDOpnFXDqL3BPIQn5lfcAkSsivYQatCCakoHk4fLGd7QjfAaNGYE3Ox+/ZI6Lq0e1gGcz1qdw/IbA=="
      },
      {
        "name": "@lydell/node-pty",
        "spec": "1.2.0-beta.12",
        "resolvedVersion": "1.2.0-beta.12",
        "integrity": "sha512-qIK890UwPupoj07osVvgOIa++1mxeHbcGry4PKRHhNVNs81V2SCG34eJr46GybiOmBtc8Sj5PB1/GGM5PL549g=="
      },
      {
        "name": "@mistralai/mistralai",
        "spec": "2.4.0",
        "resolvedVersion": "2.4.0",
        "integrity": "sha512-t6hCx242MTGolB76CI+17jDtPIe/bzLsMdUTMMoMn9Qo1h02N2G5jQYHmKDGU3X//OgR2wvngTD7tO6tPp5poQ=="
      },
      {
        "name": "@modelcontextprotocol/sdk",
        "spec": "1.29.0",
        "resolvedVersion": "1.29.0",
        "integrity": "sha512-zo37mZA9hJWpULgkRpowewez1y6ML5GsXJPY8FI0tBBCd77HEvza4jDqRKOXgHNn867PVGCyTdzqpz0izu5ZjQ=="
      },
      {
        "name": "@mozilla/readability",
        "spec": "0.6.0",
        "resolvedVersion": "0.6.0",
        "integrity": "sha512-juG5VWh4qAivzTAeMzvY9xs9HY5rAcr2E4I7tiSSCokRFi7XIZCAu92ZkSTsIj1OPceCifL3cpfteP3pDT9/QQ=="
      },
      {
        "name": "@openclaw/ai",
        "spec": "2026.7.1-beta.5",
        "resolvedVersion": "2026.7.1-beta.5",
        "integrity": "sha512-6EB875Ge0tXZaI4boe0wGBSR7kSwUFutIezhOpprBlAHXr0Jouk97jGsz/xbLTV/pJ4JC8hb9HYisktCsdzeQA=="
      },
      {
        "name": "@openclaw/fs-safe",
        "spec": "0.4.1",
        "resolvedVersion": "0.4.1",
        "integrity": "sha512-hQi+BxO10KdRFlYUot1syC+hTaUnGeQNdqX5kwkKJig8CFq1tKsYJLPm+zkiiGsSKOprPAquQl/txejEhpKPgg=="
      },
      {
        "name": "@openclaw/proxyline",
        "spec": "0.3.3",
        "resolvedVersion": "0.3.3",
        "integrity": "sha512-sftHnW69NHQqLjCxBTvQ8f/eQl+peZ5pHCBQtuTWBbeuYRHZ0/GXVTmw/O/YKsShMbqPWhJB0UYtPPdvCUSS8w=="
      },
      {
        "name": "@silvia-odwyer/photon-node",
        "spec": "0.3.4",
        "resolvedVersion": "0.3.4",
        "integrity": "sha512-bnly4BKB3KDTFxrUIcgCLbaeVVS8lrAkri1pEzskpmxu9MdfGQTy8b8EgcD83ywD3RPMsIulY8xJH5Awa+t9fA=="
      },
      {
        "name": "chalk",
        "spec": "5.6.2",
        "resolvedVersion": "5.6.2",
        "integrity": "sha512-7NzBL0rN6fMUW+f7A6Io4h40qQlG+xGmtMxfbnH/K7TAtt8JQWVQK+6g0UXKMeVJoyV5EkkNsErQ8pVD3bLHbA=="
      },
      {
        "name": "chokidar",
        "spec": "5.0.0",
        "resolvedVersion": "5.0.0",
        "integrity": "sha512-TQMmc3w+5AxjpL8iIiwebF73dRDF4fBIieAqGn9RGCWaEVwQ6Fb2cGe31Yns0RRIzii5goJ1Y7xbMwo1TxMplw=="
      },
      {
        "name": "clawpdf",
        "spec": "0.3.0",
        "resolvedVersion": "0.3.0",
        "integrity": "sha512-41+3AnKk9yek2sm+/9XvUlDTN8Wi+ag7fmxZuqw+ySn4lqaf/fCgLeamqPLiXY4gVbizKEHGoTG/JrIIFNE2rw=="
      },
      {
        "name": "commander",
        "spec": "15.0.0",
        "resolvedVersion": "15.0.0",
        "integrity": "sha512-z67u4ZhzCL/Tydu1lJARtEZYWbWaN7oYLHbsuzocr6y4N6WZAagG3RQ4FW61V1/0+jImpj293XfrcYnd1qxtPg=="
      },
      {
        "name": "croner",
        "spec": "10.0.1",
        "resolvedVersion": "10.0.1",
        "integrity": "sha512-ixNtAJndqh173VQ4KodSdJEI6nuioBWI0V1ITNKhZZsO0pEMoDxz539T4FTTbSZ/xIOSuDnzxLVRqBVSvPNE2g=="
      },
      {
        "name": "diff",
        "spec": "9.0.0",
        "resolvedVersion": "9.0.0",
        "integrity": "sha512-svtcdpS8CgJyqAjEQIXdb3OjhFVVYjzGAPO8WGCmRbrml64SPw/jJD4GoE98aR7r25A0XcgrK3F02yw9R/vhQw=="
      },
      {
        "name": "dotenv",
        "spec": "17.4.2",
        "resolvedVersion": "17.4.2",
        "integrity": "sha512-nI4U3TottKAcAD9LLud4Cb7b2QztQMUEfHbvhTH09bqXTxnSie8WnjPALV/WMCrJZ6UV/qHJ6L03OqO3LcdYZw=="
      },
      {
        "name": "express",
        "spec": "5.2.1",
        "resolvedVersion": "5.2.1",
        "integrity": "sha512-hIS4idWWai69NezIdRt2xFVofaF4j+6INOpJlVOLDO8zXGpUVEVzIYk12UUi2JzjEzWL3IOAxcTubgz9Po0yXw=="
      },
      {
        "name": "file-type",
        "spec": "22.0.1",
        "resolvedVersion": "22.0.1",
        "integrity": "sha512-ww5Mhre0EE+jmBvOXTmXAbEMuZE7uX4a3+oRCQFNj8w++g3ev913N6tXQz0XTXbueQ5TWQfm6BdaViEHHn8bhA=="
      },
      {
        "name": "glob",
        "spec": "13.0.6",
        "resolvedVersion": "13.0.6",
        "integrity": "sha512-Wjlyrolmm8uDpm/ogGyXZXb1Z+Ca2B8NbJwqBVg0axK9GbBeoS7yGV6vjXnYdGm6X53iehEuxxbyiKp8QmN4Vw=="
      },
      {
        "name": "grammy",
        "spec": "1.44.0",
        "resolvedVersion": "1.44.0",
        "integrity": "sha512-gGVykS5+c5f1tPV97LuU6IDRMawE2NzpwM9pNz58HQ35IZXDnYL3VOLvNzYognPSeBIOSzQXRu5w96V0aY8y8A=="
      },
      {
        "name": "highlight.js",
        "spec": "11.11.1",
        "resolvedVersion": "11.11.1",
        "integrity": "sha512-Xwwo44whKBVCYoliBQwaPvtd/2tYFkRQtXDWj1nackaV2JPXx3L0+Jvd8/qCJ2p+ML0/XVkJ2q+Mr+UVdpJK5w=="
      },
      {
        "name": "hosted-git-info",
        "spec": "10.1.1",
        "resolvedVersion": "10.1.1",
        "integrity": "sha512-DeOnSPAvOndYKfw075gt8yZzQ7S2hNztw34zBTfhIzLhmBTswIBg5/y+pqu/VD5cYWm5goAFTusDmUEmKZ0PEQ=="
      },
      {
        "name": "ignore",
        "spec": "7.0.5",
        "resolvedVersion": "7.0.5",
        "integrity": "sha512-Hs59xBNfUIunMFgWAbGX5cq6893IbWg4KnrjbYwX3tx0ztorVgTDA6B2sxf8ejHJ4wz8BqGUMYlnzNBer5NvGg=="
      },
      {
        "name": "jiti",
        "spec": "2.7.0",
        "resolvedVersion": "2.7.0",
        "integrity": "sha512-AC/7JofJvZGrrneWNaEnJeOLUx+JlGt7tNa0wZiRPT4MY1wmfKjt2+6O2p2uz2+skll8OZZmJMNqeke7kKbNgQ=="
      },
      {
        "name": "json5",
        "spec": "2.2.3",
        "resolvedVersion": "2.2.3",
        "integrity": "sha512-XmOWe7eyHYH14cLdVPoyg+GOH3rYX++KpzrylJwSW98t3Nk+U8XOl8FWKOgwtzdb8lXGf6zYwDUzeHMWfxasyg=="
      },
      {
        "name": "jszip",
        "spec": "3.10.1",
        "resolvedVersion": "3.10.1",
        "integrity": "sha512-xXDvecyTpGLrqFrvkrUSoxxfJI5AH7U8zxxtVclpsUtMCq4JQ290LY8AW5c7Ggnr/Y/oK+bQMbqK2qmtk3pN4g=="
      },
      {
        "name": "kysely",
        "spec": "0.29.2",
        "resolvedVersion": "0.29.2",
        "integrity": "sha512-s6WVJyEZrbm6jhBpiKHsGHyePMrVQKJ85wZCFCr9W4QHv6WTjWIrdvTmO9hDEA3bNK0xkrE2DqrHsXMLWuZpQg=="
      },
      {
        "name": "linkedom",
        "spec": "0.18.12",
        "resolvedVersion": "0.18.12",
        "integrity": "sha512-jalJsOwIKuQJSeTvsgzPe9iJzyfVaEJiEXl+25EkKevsULHvMJzpNqwvj1jOESWdmgKDiXObyjOYwlUqG7wo1Q=="
      },
      {
        "name": "minimatch",
        "spec": "10.2.5",
        "resolvedVersion": "10.2.5",
        "integrity": "sha512-MULkVLfKGYDFYejP07QOurDLLQpcjk7Fw+7jXS2R2czRQzR56yHRveU5NDJEOviH+hETZKSkIk5c+T23GjFUMg=="
      },
      {
        "name": "node-edge-tts",
        "spec": "1.2.10",
        "resolvedVersion": "1.2.10",
        "integrity": "sha512-bV2i4XU54D45+US0Zm1HcJRkifuB3W438dWyuJEHLQdKxnuqlI1kim2MOvR6Q3XUQZvfF9PoDyR1Rt7aeXhPdQ=="
      },
      {
        "name": "openai",
        "spec": "6.45.0",
        "resolvedVersion": "6.45.0",
        "integrity": "sha512-5DQVNErssk0afNpTTHUm/qZPU4iKR9OYdNid8Ib4puq4gHNNvGWZht2zY4h9a8JMF949Ik6m8gQutllVPbjdnw=="
      },
      {
        "name": "partial-json",
        "spec": "0.1.7",
        "resolvedVersion": "0.1.7",
        "integrity": "sha512-Njv/59hHaokb/hRUjce3Hdv12wd60MtM9Z5Olmn+nehe0QDAsRtRbJPvJ0Z91TusF0SuZRIvnM+S4l6EIP8leA=="
      },
      {
        "name": "playwright-core",
        "spec": "1.61.1",
        "resolvedVersion": "1.61.1",